{
  "id": "metrics-collection",
  "type": "constraint",
  "boot": true,
  "lifecycle": "permanent",
  "scope": "core",
  "tags": [
    "metrics",
    "quality",
    "refinement",
    "measurement"
  ],
  "created": "2026-04-08T00:00:00Z",
  "created_by": "user",
  "updated": "2026-04-13T00:00:00Z",
  "updated_by": "leo",
  "content": {
    "anti_patterns": [
      "Marking delegation.quality as 'correct_first' when it wasn't \u2014 that's the honesty problem self_qa.honest exists to catch, applied to Leo",
      "Skipping metric collection for 'trivial' tasks \u2014 every task gets a metric entry, no exceptions",
      "Measuring subjective quality ('did the code come out pretty?') \u2014 metrics are binary or countable",
      "Optimizing for token cost at the expense of quality \u2014 the refinement decision should never be to cut corners"
    ],
    "how_to_apply": [
      "Storage: each metric is a KB doc in .claude/kb/docs/ with type: metric, tagged with the manager name and domain. Replaces the old .claude/metrics/*.jsonl approach \u2014 metrics now live in the KB, queryable via index",
      "Collection: Leo writes the metric doc when closing the task. Specialists pass raw data to Leo as part of their final report",
      "The 9 metrics: (1) peer review pass rate \u2014 review.first_pass + review.iterations, (2) user rejection rate \u2014 user.accepted_on_delivery, (3) self-QA honesty \u2014 self_qa.honest, (4) rework cycles \u2014 rework_cycles count, (5) hiring loop hit rate \u2014 hiring_loop.outcome, (6) delegation quality \u2014 delegation.quality, (7) internal iterations \u2014 internal_iterations count, (8) leo errors \u2014 leo_errors array, (9) session cost \u2014 cost.tokens_in, cost.tokens_out, cost.cost_usd, cost.model (captured via /cost command at wrap-up)",
      "Periodic review: every 20-30 tasks, user asks Leo for metrics report. Leo reads metric docs from KB via index (by_type.metric), aggregates, presents rates and worst cases",
      "Leo must record his own errors with the same rigor as the team's. Metrics that only measure output quality without process quality are structurally biased toward positive"
    ],
    "responsibility": "Leo writes metric entries. Specialists provide raw data. Owner audits periodically. If Leo forgets to log, the dataset becomes skewed and refinement decisions will be biased.",
    "why": "Any system that intends to be refinable needs a measurable fitness function. Without metrics, refining the core becomes guesswork. With metrics, we look at the worst numbers and go straight to the pain. Two immediate uses: (1) deciding where to refine after 20-30 tasks, (2) input for offline auto-refinement loop.",
    "constraint": "Every executed task leaves one metric entry as a KB doc (type: metric). This creates the dataset for refining agents and rules based on real data \u2014 not guesswork."
  },
  "summary": "Every executed task leaves one metric entry as a KB doc (type: metric). This creates the dataset for refining agents and"
}
