{
  "id": "v010-scope",
  "type": "decision",
  "boot": false,
  "summary": "v0.10.0 scope: LEO→MOM rebrand, dead code cleanup, bootstrap fixes, Homebrew, docs overhaul. Deferred: mom-protocol extraction, mom-web (independent), outreach wave (decoupled).",
  "lifecycle": "permanent",
  "scope": "project",
  "tags": ["release", "v0-10", "rebrand", "scope"],
  "created": "2026-04-20T00:00:00Z",
  "created_by": "claude",
  "updated": "2026-04-20T00:00:00Z",
  "updated_by": "claude",
  "content": {
    "what": "v0.10.0 release scope definition",
    "decision": "v0.10 is the rebrand release. All subsequent feature work ships under MOM identity.",
    "scope_items": {
      "rebrand": [
        "Path migration .leo/ → .mom/ with mom upgrade",
        "CLI rename leo → mom with leo alias + deprecation warning",
        "LEO → MOM everywhere (~850 occurrences)",
        "KB → Memory terminology (~130 occurrences, package rename kb/ → memory/)",
        "Glossary enforcement (service names → architecture docs)"
      ],
      "dead_code_cleanup": [
        "Remove leo update command (sync eliminated by MCP)",
        "Remove profile sync in export/import",
        "Remove DefaultTierMapping + HookDef from adapter interface",
        "Delete rules/ and leo-export/ directories",
        "Remove legacySpecialists, unused MemoryConfig fields, discoverUninitializedChildRepos, Health(), GenerateAll(), vacuous tests",
        "Fix constraint texts (specialist, profile, pipeline tiers)",
        "Remove SessionEvent.Tier, languageLabel dead branches, uninstall text"
      ],
      "bug_fixes": [
        "Bootstrap index.json regeneration after writeDrafts",
        "Auto-open graph after bootstrap (--no-graph flag)",
        "Cross-platform openBrowser (xdg-open for Linux)"
      ],
      "improvements": [
        "CLAUDE.md boot rework: index lookup by tag, logs fallback, version check",
        "CLI version check on boot (cache-based, zero latency)",
        "Homebrew formula (brew install mom)"
      ],
      "documentation": [
        "README rewrite under MOM identity",
        "Usage guides: getting-started, best-practices, mcp-setup, migration, scope-hierarchy",
        "CHANGELOG retroactive entries"
      ]
    },
    "deferred": [
      "mom-protocol extraction — defer post v0.11 when protocol stabilizes",
      "mom-web repo — independent of release cadence",
      "Outreach wave — decoupled from releases, execute when ready"
    ],
    "kept_for_future": [
      "ReadAllScopes / InheritedDoc in multiscope.go — needed for MCP multi-scope recall in v0.11"
    ],
    "issues": ["#83", "#84", "#85", "#86", "#87", "#88", "#89", "#90", "#91", "#92", "#93"],
    "milestone": "v0.10.0 (GitHub milestone #5)",
    "pending_decisions": 15,
    "rationale": "Do rebrand first so all subsequent feature work ships under MOM identity. Clean dead code before renaming to avoid renaming code that will be deleted."
  }
}
